m_1;52.3494703659177;4.63031105906557;m_1; dit is een mooie omschrijving;31 maart 2017;duivelswerk amsterdam;Volgens de christelijke leer is Jezus de eniggeboren Zoon van God en de door God in het Oude Testament (Tenach) bij monde van de profeten beloofde messias (o.a. Jesaja 53:3 en verder),[1] de Gezalfde van God, die de mensen verlost van hun zonden en de harmonie tussen God en mensen, die verbroken was als gevolg van de zondeval van de eerste mensen in het paradijs, herstelt. Volgens de Bijbel is Jezus geboren om de mensen te redden van hun zonden. Volgens de uitleg in de evangeliën maakte zijn dood de verzoening met God de Vader mogelijk, doordat hij de straf voor de zonden van de mensheid op zich nam: Jezus is "het Lam van God dat de zonden van de wereld wegneemt." De opvatting dat Jezus met zijn kruisdood de mens verzoent met God, wordt beschreven als verzoeningsleer. Het abrahamitische principe van de rechtvaardiging door geloof kreeg daardoor een nieuwe betekenis: ieder die Jezus navolgt, zal voor God gerechtvaardigd (gerehabiliteerd) zijn.
m_2;52.3594703659177;4.65031105906557;m_2;  vind je dat ook niet;5 mei 1940;smidse straat, haarlem;Ome Kees, ofwel Cornelis Johannes van den Genugten, overlijdt op 68-jarige leeftijd rond sluitingstijd in het Amsterdamse café Het Pronkjuweel. Tot verbijstering van de argeloze stamgasten heeft hij twee messteken in zijn rug op de plaats van zijn hart en zijn nieren. Oscar Graanoogst is bij de commando’s geweest en samen met lijkschouwer Bertels herkent hij de hand van een commando. Ome Kees kwam al een jaar of tien standaard in zijn stamcafé nadat zijn vrouw was overleden. In zijn woning aan de Gasthuisdwarsstraat vinden de twee rechercheurs veel oude rommel en een gigantisch flatscreen televisietoestel, dat naar later blijkt wel 10.000 euro heeft gekost. Volgens de benedenbuurvrouw kwam Gore Gerard van Avezaath elke maand de rente en aflossing incasseren. Hij wordt gelinkt aan geldschieter Ricardo Dalstra, een woekeraar die in sex en pornoartikelen handelt. Samen met zijn advocaat wordt laatstgenoemde op het bureau Raampoort verhoord. Hij geeft een hint inzake De Gouden Leeuw. Dat is een kroeg waarvan Hendrick weet dat hij door de link met kinderporno heeft moeten sluiten.
m_3;52.3294703659177;4.61031105906557;m_3;  konan konan konan konan konan konan konan konan konan konan konan konan konan konan konan konan konan konan konan konan;8 november 1940;ergens in haarlem;Op 17 december 1969 werd het premetrostation Schuman geopend als eindpunt van de eerste premetrolijn tussen De Brouckère en Schuman. Met de inhuldiging van de Brusselse metro op 20 september 1976 werden de perrons van het station verhoogd om deze toegankelijk voor de metrostellen van de toenmalige metrolijn 1 tussen De Brouckère en Tomberg / Beaulieu.
m_4;52.3594703659177;4.63031105906557;m_4;  leander leander leander leander leander leander leander leander leander leander leander leander leander leander leander leander;30 januari 1991; de dijkplein;Het metrostation Schuman bedient de Europese wijk van Brussel onder het Schumanplein. In de directe omgeving zijn talrijke gebouwen te vinden die deel uitmaken van de Europese Unie: Europese Commissie, Europees Parlement in Brussel en de Raad van Europa. Van de talloze ingangen die dit station kent komt er een uit op de esplanade voor het Berlaymontgebouw van de Europese Commissie, andere monden uit in de Wetstraat of het Schumanplein.
m_5;52.3424703659177;4.636031105906557;m_5;  berend berend berend berend berend berend berend berend berend berend berend berend berend berend berend berend berend berend;30 augustus 1995; hoofdstraat haarlem;Hij begon met voetballen in het jeugdelftal van een Ghanese club FC Nania. In 2003 ging hij naar Italië om te gaan spelen voor de amateurclub SS Manfredonia. Hij speelde daar 3 jaar en koos uiteindelijk voor een andere club uit het Serie D. Dit keer was het AC Rimini. Dankzij goede prestaties bij deze club had hij de mogelijkheid om naar AS Roma te gaan. Hij speelde daar niet vaak en werd uitgeleend aan andere clubs zoals o.a Galatasaray SK, Brescia Calcio en Torino FC. Hij mocht ook al 6 maal voor de nationale ploeg van Ghana spelen.
m_6;52.3454703659177;4.674031105906557;m_6; Diovae Diovae Diovae Diovae Diovae Diovae Diovae Diovae Diovae Diovae Diovae Diovae Diovae Diovae Diovae Diovae Diovae Diovae;7 april 1955;voltooid deelstraat;Intussen heeft wachtcommandant Leo Esterik vanaf dag 1 gepoogd het onderzoek te leiden. Hij zet 3 teams van 2 rechercheurs op de zaak, waarbij Oscar en Hendrick het voornaamste werk doen. De enige zoon van de overledene, Egbert en zijn vrouw Cecilia worden in Oldenzaal opgespoord. Ze zeggen de afgelopen 10 jaar geen contact meer met Ome Kees te hebben gehad. Maar langzaam aan brokkelt hun verdediging af en de tip inzake kinderporno blijkt raak. Zijn vader verhandelde vroeger kinderpornofoto’s van Egbert en de twee rechercheurs bespeuren nu een nieuw motief; wraak. Op de verjaardag van Hendrick zijn moeder memoreert oom Jurriaan het belang van familie. Als een van de stamgasten, Boonstra, melding maakt van een onbekende vrouw in het café op de avond van de moord draaien de hersenen van Hendrick overuren. Hij doet recherchewerk in zijn Facebook. Hij licht daar het doopceel van Cecilia. De schoondochter had lang rood haar tijdens haar diensttijd in Irak in 1991. Tijdens een derde verhoor van Egbert en Cecilia knoopt Hendrick met succes de losse eindjes aan elkaar. Getuige Boonstra sprak van een vrouw met rood haar met een tatoeage op haar borst. Hendrick meent zoiets op facebook gezien te hebben bij Cecilia en stelt botweg dat ze inmiddels door twee stamgasten herkend is. Terwijl Egbert wel een alibi heeft, heeft Cecilia zulks niet. Als trotse commando bekent ze uiteindelijk de steekpartij. Ze was die bewuste avond komen praten met haar schoonvader. Die wilde 10.000 euro hebben voor een oude kinderpornofoto van Egbert. Maar toen hij zijn onbekende schoondochter zag, wilde hij seks met haar als compensatie. Haar stiletto werkte net als het mes in haar commandotijd, geruisloos en efficiënt.